{
  "schema_version": 1,
  "checkpoint_id": "CP-001",
  "task_id": "TASK-SUP-REMEDIATION-001",
  "execution_id": "EXEC-SUP-REMEDIATION-001-DIRECT",
  "generation": 31,
  "sequence": 1,
  "created_at": "2026-09-23T14:22:00Z",
  "completed_steps": [
    "Repaired Supervisor Service Agent Core in place to independently verified item-19 snapshot",
    "Preserved stable identity, mandate, Supervisor profile, goals, and professional memory",
    "Reconciled mandatory portfolio beliefs/projects/agents against live Registry and audit evidence",
    "Added Supervisor-specific mandatory portfolio reconciliation invariant",
    "Freshly reinstantiated ecosystem-supervisor from remediated repository",
    "Validated Owner-issued remediation task against Supervisor mandate",
    "Revalidated exact active generation-31 execution fence immediately before this write"
  ],
  "verified_evidence": [
    "lvlaksim1/supervisor@fcd0ba5d34be592a84da8784dfa6bb3498efdbe6",
    "Context Capsule Core 1947fb2cb3567e6482e7410e42a3763418186c40",
    "Installed ENTRYPOINT/CONTRACT/PROTOCOL blobs exactly match current Service Agent Base",
    "identity/mandate/Supervisor-profile/goals/semantic-memory/memory-index blobs preserved across repair",
    "gateway lease generation 31 execution EXEC-SUP-REMEDIATION-001-DIRECT matched before checkpoint write"
  ],
  "target_state_refs": [
    {
      "repository": "lvlaksim1/supervisor",
      "ref": "fcd0ba5d34be592a84da8784dfa6bb3498efdbe6"
    },
    {
      "repository": "lvlaksim1/project-manager-auditor",
      "ref": "6cb7e12ff037677f5c04f6e3ad624b2ede02531d",
      "path": "audits/AUD-2026-09-23-SUPERVISOR-001.md"
    }
  ],
  "next_action": "Complete deterministic Service Agent validation/recovery checks, persist verification state, then submit exact remediation snapshot for focused independent Auditor retest."
}
